{
  "specversion": "1.0",
  "source": "urn:vm:a",
  "subject": "instances/a",
  "id": "00000000-0000-0000-0000-000000000004",
  "type": "io.github.bbororo5.cloudusage.instance.occupancy.confirmed.v1",
  "time": "2026-09-01T10:02:00Z",
  "datacontenttype": "application/json",
  "dataschema": "https://github.com/bbororo5/cloud-usage-billing/blob/main/contracts/v1/instance-occupancy-event.schema.json",
  "data": {
    "sequence": 4,
    "confirmedThrough": "2026-09-01T10:02:00Z"
  }
}
